Ж;ЕГОРОВА АННА;25.02.1987;МС;СТАВРОПОЛЬСКИЙ КР.; ;;ЦСП;ТКАЧЕВ В.И.,РОГАЧЕВА Л.В. МАСЛАКОВ В.М.;100
Ж;КАЦУРА ЮЛИЯ;28.05.1983;МСМК;КРАСНОДАРСКИЙ КР.;МОСКОВСКАЯ ОБЛ.;Л;ЦСП ПО Л/А;МАСЛАКОВ В.М., ГЛАДЫРЬ М.Ф., ФУНИКОВ В.В.;100
Ж;КАШИНА ЮЛИЯ;26.02.1987;МСМК;КРАСНОЯРСКИЙ КР.;ВОЛОГОДСКАЯ ОБЛ.;АЛВС;;ЛЕОНЕНКО С.Г., СИНИЦКИЙ А.Д.;100
Ж;КОЗЛОВА  ЕЛЕНА;19.09.1988;МС;САНКТ-ПЕТЕРБУРГ;ВОЛОГОДСКАЯ ОБЛ.;;ШВСМ;СМЕЛОВ Н.А, КЛИМОВ А.Г.;100
Ж;КУЗИНА ЕКАТЕРИНА;28.06.1991;МС;МОСКВА;;ЮМ;СДЮСШОР ЮМ;КУЗИН В.В.,  КУЗИНА Е.В.;100
Ж;ЛУНЕВА СОФЬЯ;10.11.1992;КМС;СТАВРОПОЛЬСКИЙ КР.; ;;ЦСП,СУОР;ТКАЧЕВ В.И.., РОГАЧЕВА Л.В.;100
Ж;РУСАКОВА НАТАЛЬЯ;12.12.1979;ЗМС;МОСКВА;САНКТ-ПЕТЕРБУРГ;;ЦСП ПО Л/А;РЕШЕТНИКОВА Т.В., ГУСЕВА А.М.;100